{
 "authority": {
  "can_decide": false,
  "note": "Commander-casting/tax stress cannot decide mana-base swaps or deck changes."
 },
 "canonical_hash": "lh1:6d87a5e4a87ac6dd866849a1f1d31c15e25b5a6a283b9d89b7b398e1f5696f5b",
 "commanders": [
  {
   "baseline": {
    "cast_by_turn": {
     "10": 0.99,
     "2": 0.03,
     "3": 0.456,
     "4": 0.852,
     "5": 0.914,
     "6": 0.94,
     "8": 0.974
    },
    "cast_share_by_turn10": 0.99,
    "mana_available_by_turn": [
     0.848,
     2.16,
     3.668,
     4.578,
     5.382,
     6.062,
     6.644,
     7.164,
     7.69,
     8.174
    ],
    "mana_spent_by_turn": [
     0.23,
     1.922,
     3.48,
     4.222,
     4.69,
     5.066,
     5.066,
     4.964,
     4.714,
     4.418
    ],
    "mean_turn_when_cast": 3.8222
   },
   "commander": "Ashad, the Lone Cyberman",
   "fast_mana_contribution": {
    "interpretation": "Positive values mean the listed fast-mana package increases/accelerates commander casting in this bounded goldfish counterfactual.",
    "mean_turn_acceleration_when_both_cast": {
     "ci95": [
      1.2018,
      1.5464
     ],
     "paired_games": 433,
     "value": 1.3741
    },
    "paired_cast_probability_delta_by_turn": {
     "2": {
      "ci95": [
       0.015032,
       0.044968
      ],
      "value": 0.03
     },
     "3": {
      "ci95": [
       0.412299,
       0.499701
      ],
      "value": 0.456
     },
     "4": {
      "ci95": [
       0.278101,
       0.365899
      ],
      "value": 0.322
     },
     "5": {
      "ci95": [
       0.258659,
       0.341341
      ],
      "value": 0.3
     },
     "6": {
      "ci95": [
       0.205507,
       0.282493
      ],
      "value": 0.244
     }
    }
   },
   "fast_mana_inventory": [
    "Arcane Signet",
    "Fellwar Stone",
    "Great Furnace",
    "Mox Opal",
    "Rakdos Signet",
    "Seat of the Synod",
    "Sol Ring",
    "Talisman of Creativity",
    "Talisman of Dominance",
    "Talisman of Indulgence",
    "Vault of Whispers"
   ],
   "no_fast_mana_counterfactual": {
    "cast_by_turn": {
     "10": 0.87,
     "2": 0.0,
     "3": 0.0,
     "4": 0.53,
     "5": 0.614,
     "6": 0.696,
     "8": 0.786
    },
    "cast_share_by_turn10": 0.87,
    "mana_available_by_turn": [
     0.828,
     1.892,
     2.724,
     3.404,
     3.894,
     4.314,
     4.706,
     5.034,
     5.412,
     5.708
    ],
    "mana_spent_by_turn": [
     0.07,
     0.988,
     2.228,
     2.954,
     2.952,
     3.366,
     3.43,
     3.498,
     3.644,
     3.662
    ],
    "mean_turn_when_cast": 5.1517
   },
   "static_cost": {
    "all_required_colors_present_by_base_turn": 0.697349,
    "base_resource_target": 4,
    "colored_requirements": {
     "B": 1,
     "R": 1,
     "U": 1
    },
    "first_recast_resource_target": 6,
    "mana_cost": "{1}{U}{B}{R}",
    "mana_value": 4.0,
    "name": "Ashad, the Lone Cyberman",
    "per_color_source_presence_by_base_turn": {
     "B": 0.871941,
     "R": 0.830741,
     "U": 0.888913
    },
    "second_recast_resource_target": 8
   },
   "tax_recovery_after_one_removal": {
    "event_count": 495,
    "recast_count": 460,
    "recast_share_given_removal": 0.929293,
    "recast_within_turns_given_removal": {
     "1": 0.266667,
     "2": 0.654545,
     "3": 0.767677
    },
    "recovery_turns_mean_when_recast": {
     "ci95": [
      2.1862,
      2.4268
     ],
     "value": 2.3065
    },
    "removal_event_share": 0.99
   },
   "tax_recovery_after_two_removals": {
    "first": {
     "event_count": 495,
     "recast_count": 460,
     "recast_share_given_removal": 0.929293,
     "recast_within_turns_given_removal": {
      "1": 0.266667,
      "2": 0.654545,
      "3": 0.767677
     },
     "recovery_turns_mean_when_recast": {
      "ci95": [
       2.1862,
       2.4268
      ],
      "value": 2.3065
     },
     "removal_event_share": 0.99
    },
    "second": {
     "event_count": 460,
     "recast_count": 309,
     "recast_share_given_removal": 0.671739,
     "recast_within_turns_given_removal": {
      "1": 0.141304,
      "2": 0.423913,
      "3": 0.547826
     },
     "recovery_turns_mean_when_recast": {
      "ci95": [
       2.3123,
       2.5874
      ],
      "value": 2.4498
     },
     "removal_event_share": 0.92
    }
   }
  }
 ],
 "confidence": "moderate",
 "deck_id": "Ashad__the_Lone_Cyberman",
 "evidence_class": "test_result",
 "limitations": [
  "Goldfish engine only: no real opponents, interaction, politics or multiplayer win rates.",
  "Removal stress deterministically removes the isolated commander at end of the first eligible turn; it is a tax-recovery stress, not a real removal-frequency estimate.",
  "The no-fast counterfactual keeps fast-mana cards in draws but disables their mana modes and makes them uncastable; this isolates acceleration but ignores any alternate non-mana use.",
  "Existing grixis_sim v1.1 mana/card-effect limitations remain in force; this wrapper does not silently upgrade that simulator.",
  "Partner/background-style pairs are evaluated per commander to remove cast-order confounding; actual games can allocate mana between commanders differently.",
  "These tests measure commander access/recovery only; Step D separately measures commander marginal strategic value once available."
 ],
 "method": {
  "commander_pair_policy": "each commander is simulated separately with the same 99 and deck color identity; co-commander cast-order competition is intentionally removed",
  "model": "1.1",
  "pairing": "same library permutations for baseline, no-fast counterfactual, and removal perturbations",
  "samples": 500,
  "seed": 6813,
  "simulator": "grixis_sim",
  "simulator_sha256": "sha256:55ddceac7125dba7f6d7ec55ef951c88cb452471f89bf5ffb774014e27822d58",
  "turns": 10
 },
 "schema_version": 1,
 "slug": "ashad-the-lone-cyberman",
 "status": "provisional_test_evidence"
}
